{
  "id": "calculus",
  "name": "Toán cao cấp",
  "description": "Câu hỏi trắc nghiệm về Toán cao cấp",
  "questions": [
    {
      "id": 1,
      "question": "Đạo hàm của hàm số f(x) = x² là gì?",
      "options": {
        "A": "x",
        "B": "2x",
        "C": "x²",
        "D": "2x²"
      },
      "correctAnswer": "B",
      "explanation": "Theo quy tắc đạo hàm cơ bản: d/dx(x^n) = n*x^(n-1), nên đạo hàm của x² là 2x."
    },
    {
      "id": 2,
      "question": "Tích phân của ∫x dx từ 0 đến 1 bằng bao nhiêu?",
      "options": {
        "A": "0",
        "B": "1/2",
        "C": "1",
        "D": "2"
      },
      "correctAnswer": "B",
      "explanation": "∫x dx = x²/2, tính từ 0 đến 1: (1²/2) - (0²/2) = 1/2."
    },
    {
      "id": 3,
      "question": "Giới hạn lim(x→0) (sin x)/x bằng bao nhiêu?",
      "options": {
        "A": "0",
        "B": "1",
        "C": "∞",
        "D": "Không tồn tại"
      },
      "correctAnswer": "B",
      "explanation": "Đây là một giới hạn cơ bản quan trọng trong giải tích: lim(x→0) (sin x)/x = 1."
    },
    {
      "id": 4,
      "question": "Hàm số f(x) = |x| có đạo hàm tại x = 0 không?",
      "options": {
        "A": "Có, đạo hàm bằng 0",
        "B": "Có, đạo hàm bằng 1",
        "C": "Không, vì hàm không liên tục tại x = 0",
        "D": "Không, vì đạo hàm trái và phải khác nhau"
      },
      "correctAnswer": "D",
      "explanation": "Hàm |x| liên tục tại x = 0 nhưng không có đạo hàm tại điểm này vì đạo hàm trái (-1) khác đạo hàm phải (+1)."
    },
    {
      "id": 5,
      "question": "Ma trận A là ma trận khả nghịch khi nào?",
      "options": {
        "A": "Khi det(A) = 0",
        "B": "Khi det(A) ≠ 0",
        "C": "Khi A là ma trận vuông",
        "D": "Khi A là ma trận đối xứng"
      },
      "correctAnswer": "B",
      "explanation": "Ma trận A khả nghịch (có ma trận nghịch đảo) khi và chỉ khi định thức của A khác 0."
    }
  ]
}
